{
  "id": "REQ-02",
  "status": "covered",
  "reason": "Deposit validation enforces a lower bound (amount must be > 0) and an upper bound (amount must not exceed 50 000.00) at the service layer. Six dedicated tests exercise zero, negative, boundary-exact-reject, boundary-exact-accept, a general positive value, and accumulation across multiple deposits.",
  "code_evidence": [
    {
      "file": "ledgerlite/services.py",
      "line": 19,
      "snippet": "_MAX_DEPOSIT = Decimal(\"50000.00\")",
      "verified": false,
      "match": "not_found",
      "actual_line": null,
      "actual_snippet": ""
    },
    {
      "file": "ledgerlite/services.py",
      "line": 135,
      "snippet": "    if amount <= Decimal(\"0\"):",
      "verified": true,
      "match": "relocated",
      "actual_line": 111,
      "actual_snippet": "    if amount <= Decimal(\"0\"):"
    },
    {
      "file": "ledgerlite/services.py",
      "line": 136,
      "snippet": "        raise HTTPException(status_code=400, detail=\"Deposit amount must be greater than 0\")",
      "verified": false,
      "match": "not_found",
      "actual_line": null,
      "actual_snippet": "    day = moment.astimezone(datetime.timezone.utc).date()"
    },
    {
      "file": "ledgerlite/services.py",
      "line": 137,
      "snippet": "    if amount > _MAX_DEPOSIT:",
      "verified": false,
      "match": "not_found",
      "actual_line": null,
      "actual_snippet": "    return datetime.datetime(day.year, day.month, day.day, tzinfo=datetime.timezone.utc)"
    },
    {
      "file": "ledgerlite/services.py",
      "line": 138,
      "snippet": "        raise HTTPException(status_code=400, detail=f\"Deposit amount must not exceed {_MAX_DEPOSIT}\")",
      "verified": false,
      "match": "not_found",
      "actual_line": null,
      "actual_snippet": ""
    }
  ],
  "test_evidence": [
    {
      "file": "ledgerlite/tests/test_spec2_deposit_limits.py",
      "test_name": "test_zero_rejected",
      "exists": false
    },
    {
      "file": "ledgerlite/tests/test_spec2_deposit_limits.py",
      "test_name": "test_negative_rejected",
      "exists": false
    },
    {
      "file": "ledgerlite/tests/test_spec2_deposit_limits.py",
      "test_name": "test_boundary_50000_01_rejected",
      "exists": false
    },
    {
      "file": "ledgerlite/tests/test_spec2_deposit_limits.py",
      "test_name": "test_boundary_50000_accepted",
      "exists": false
    },
    {
      "file": "ledgerlite/tests/test_spec2_deposit_limits.py",
      "test_name": "test_positive_amount_accepted",
      "exists": false
    },
    {
      "file": "ledgerlite/tests/test_spec2_deposit_limits.py",
      "test_name": "test_multiple_deposits_accumulate",
      "exists": false
    }
  ]
}
