{
  "id": "REQ-02",
  "status": "covered",
  "reason": "All four acceptance criteria are correctly implemented in ledgerlite/services.py and each is asserted by at least one dedicated test in test_spec2_deposit_limits.py. Zero and negative amounts are rejected via a single '<= 0' guard (lines 132-133); amounts above 50,000.00 are rejected via the '_MAX_DEPOSIT' upper-bound guard (lines 134-135); and the exact boundary value 50,000.00 is accepted.",
  "code_evidence": [
    {
      "file": "ledgerlite/services.py",
      "line": 18,
      "snippet": "_MAX_DEPOSIT = Decimal(\"50000.00\")",
      "verified": true,
      "match": "exact",
      "actual_line": 18,
      "actual_snippet": "_MAX_DEPOSIT = Decimal(\"50000.00\")"
    },
    {
      "file": "ledgerlite/services.py",
      "line": 132,
      "snippet": "if amount <= Decimal(\"0\"):",
      "verified": true,
      "match": "exact",
      "actual_line": 132,
      "actual_snippet": "    if amount <= Decimal(\"0\"):"
    },
    {
      "file": "ledgerlite/services.py",
      "line": 133,
      "snippet": "    raise HTTPException(status_code=400, detail=\"Deposit amount must be greater than 0\")",
      "verified": true,
      "match": "exact",
      "actual_line": 133,
      "actual_snippet": "        raise HTTPException(status_code=400, detail=\"Deposit amount must be greater than 0\")"
    },
    {
      "file": "ledgerlite/services.py",
      "line": 134,
      "snippet": "if amount > _MAX_DEPOSIT:",
      "verified": true,
      "match": "exact",
      "actual_line": 134,
      "actual_snippet": "    if amount > _MAX_DEPOSIT:"
    },
    {
      "file": "ledgerlite/services.py",
      "line": 135,
      "snippet": "    raise HTTPException(status_code=400, detail=f\"Deposit amount must not exceed {_MAX_DEPOSIT}\")",
      "verified": true,
      "match": "exact",
      "actual_line": 135,
      "actual_snippet": "        raise HTTPException(status_code=400, detail=f\"Deposit amount must not exceed {_MAX_DEPOSIT}\")"
    }
  ],
  "test_evidence": [
    {
      "file": "ledgerlite/tests/test_spec2_deposit_limits.py",
      "test_name": "test_zero_rejected",
      "exists": true
    },
    {
      "file": "ledgerlite/tests/test_spec2_deposit_limits.py",
      "test_name": "test_negative_rejected",
      "exists": true
    },
    {
      "file": "ledgerlite/tests/test_spec2_deposit_limits.py",
      "test_name": "test_boundary_50000_01_rejected",
      "exists": true
    },
    {
      "file": "ledgerlite/tests/test_spec2_deposit_limits.py",
      "test_name": "test_boundary_50000_accepted",
      "exists": true
    },
    {
      "file": "ledgerlite/tests/test_spec2_deposit_limits.py",
      "test_name": "test_positive_amount_accepted",
      "exists": true
    },
    {
      "file": "ledgerlite/tests/test_spec2_deposit_limits.py",
      "test_name": "test_multiple_deposits_accumulate",
      "exists": true
    }
  ],
  "suggested_fix": ""
}
