{
  "id": "REQ-10",
  "status": "covered",
  "reason": "Transfers where the sender or recipient has a country_code in {KP, IR, SY, CU} are rejected with HTTP 400 and detail 'sanctions'. A sanctions_blocked audit entry is written before rejection. All 9 test cases (4 sender-blocked, 4 recipient-blocked, 1 audit-entry) pass.",
  "code_evidence": [
    {
      "file": "ledgerlite/services.py",
      "line": 23,
      "snippet": "_SANCTIONED_COUNTRIES = {\"KP\", \"IR\", \"SY\", \"CU\"}",
      "verified": true
    },
    {
      "file": "ledgerlite/services.py",
      "line": 180,
      "snippet": "    if sender.country_code in _SANCTIONED_COUNTRIES or recipient.country_code in _SANCTIONED_COUNTRIES:",
      "verified": true
    },
    {
      "file": "ledgerlite/services.py",
      "line": 184,
      "snippet": "            action=\"sanctions_blocked\",",
      "verified": true
    },
    {
      "file": "ledgerlite/services.py",
      "line": 190,
      "snippet": "        raise HTTPException(status_code=400, detail=\"sanctions\")",
      "verified": true
    }
  ],
  "test_evidence": [
    {
      "file": "ledgerlite/tests/test_spec10_sanctions.py",
      "test_name": "test_sanctioned_sender_blocked[KP]"
    },
    {
      "file": "ledgerlite/tests/test_spec10_sanctions.py",
      "test_name": "test_sanctioned_sender_blocked[IR]"
    },
    {
      "file": "ledgerlite/tests/test_spec10_sanctions.py",
      "test_name": "test_sanctioned_sender_blocked[SY]"
    },
    {
      "file": "ledgerlite/tests/test_spec10_sanctions.py",
      "test_name": "test_sanctioned_sender_blocked[CU]"
    },
    {
      "file": "ledgerlite/tests/test_spec10_sanctions.py",
      "test_name": "test_sanctioned_recipient_blocked[KP]"
    },
    {
      "file": "ledgerlite/tests/test_spec10_sanctions.py",
      "test_name": "test_sanctioned_recipient_blocked[IR]"
    },
    {
      "file": "ledgerlite/tests/test_spec10_sanctions.py",
      "test_name": "test_sanctioned_recipient_blocked[SY]"
    },
    {
      "file": "ledgerlite/tests/test_spec10_sanctions.py",
      "test_name": "test_sanctioned_recipient_blocked[CU]"
    },
    {
      "file": "ledgerlite/tests/test_spec10_sanctions.py",
      "test_name": "test_audit_entry_written_for_sanctions_block"
    }
  ]
}