{
  "id": "REQ-05",
  "status": "contradicts",
  "reason": "The spec (v2.0) requires a pending_approval threshold of 5,000.00, but the implementation uses 10,000.00 \u2014 the old v1.0 threshold. Transfers between 5,000.00 and 9,999.99 are therefore completed immediately instead of being held for approval. The self-approval guard is correctly implemented.",
  "code_evidence": [
    {
      "file": "ledgerlite/services.py",
      "line": 20,
      "snippet": "_LARGE_TRANSFER_THRESHOLD = Decimal(\"10000.00\")",
      "verified": true
    },
    {
      "file": "ledgerlite/services.py",
      "line": 182,
      "snippet": "    large = amount >= _LARGE_TRANSFER_THRESHOLD",
      "verified": true
    },
    {
      "file": "ledgerlite/services.py",
      "line": 183,
      "snippet": "    status = \"pending_approval\" if large else \"completed\"",
      "verified": true
    },
    {
      "file": "ledgerlite/services.py",
      "line": 222,
      "snippet": "    if transfer.sender_id == approver_id:",
      "verified": true
    },
    {
      "file": "ledgerlite/services.py",
      "line": 223,
      "snippet": "        raise HTTPException(status_code=403, detail=\"Initiator cannot approve their own transfer\")",
      "verified": true
    }
  ],
  "test_evidence": [],
  "suggested_fix": "1. In ledgerlite/services.py line 19, change the threshold constant from 10000.00 to 5000.00:\n   _LARGE_TRANSFER_THRESHOLD = Decimal(\"5000.00\")\n\n2. Add a test asserting that a transfer of exactly 5,000.00 results in pending_approval status, for example:\n   def test_transfer_at_threshold_is_pending_approval():\n       response = client.post(\"/transfers\", json={\"amount\": \"5000.00\", ...})\n       assert response.json()[\"status\"] == \"pending_approval\"\n\n3. Add a complementary test confirming that a transfer of 4,999.99 is completed immediately (boundary below threshold)."
}