{
  "id": "REQ-11",
  "status": "missing",
  "reason": "No masking logic exists anywhere in the codebase. The statement endpoint returns a full AccountResponse whose account_number field is an unmasked string. No test verifies that account numbers are masked in statement responses.",
  "code_evidence": [
    {
      "file": "ledgerlite/schemas.py",
      "line": 56,
      "snippet": "account_number: str   # ← FULL account number, no masking",
      "verified": true,
      "match": "relocated",
      "actual_line": 57,
      "actual_snippet": "    account_number: str"
    },
    {
      "file": "ledgerlite/main.py",
      "line": 49,
      "snippet": "@app.get(\"/accounts/{account_id}/statement\", response_model=StatementResponse)\ndef get_statement(account_id: int, db: Session = Depends(get_db)):\n    account = svc._get_account_or_404(db, account_id)\n    ...\n    return StatementResponse(account=account, transactions=transactions)",
      "verified": false,
      "match": "not_found",
      "actual_line": null,
      "actual_snippet": null
    }
  ],
  "test_evidence": [],
  "suggested_fix": "Add a masked_account_number computed field to a new StatementAccountResponse schema variant used only for statements that returns '*' * 6 + account_number[-4:]. Use this schema in StatementResponse instead of the full AccountResponse. Add a test that calls GET /accounts/{id}/statement and asserts the account_number field contains only '****' followed by 4 digits and does not contain the full number."
}
