{
  "id": "REQ-05",
  "status": "covered",
  "reason": "The v2.0 threshold of 5,000.00 is correctly implemented. Transfers >= 5,000.00 are set to pending_approval; transfers below that are completed immediately. This was fixed from the old v1.0 value of 10,000.00. All four boundary tests pass.",
  "code_evidence": [
    {
      "file": "ledgerlite/services.py",
      "line": 20,
      "snippet": "_LARGE_TRANSFER_THRESHOLD = Decimal(\"5000.00\")",
      "verified": true,
      "match": "exact",
      "actual_line": 20,
      "actual_snippet": "_LARGE_TRANSFER_THRESHOLD = Decimal(\"5000.00\")"
    },
    {
      "file": "ledgerlite/services.py",
      "line": 217,
      "snippet": "    large = amount >= _LARGE_TRANSFER_THRESHOLD",
      "verified": true,
      "match": "exact",
      "actual_line": 217,
      "actual_snippet": "    large = amount >= _LARGE_TRANSFER_THRESHOLD"
    },
    {
      "file": "ledgerlite/services.py",
      "line": 218,
      "snippet": "    status = \"pending_approval\" if large else \"completed\"",
      "verified": true,
      "match": "exact",
      "actual_line": 218,
      "actual_snippet": "    status = \"pending_approval\" if large else \"completed\""
    }
  ],
  "test_evidence": [
    {
      "file": "ledgerlite/tests/test_spec5_large_transfer_threshold.py",
      "test_name": "test_transfer_below_threshold_completed",
      "exists": true
    },
    {
      "file": "ledgerlite/tests/test_spec5_large_transfer_threshold.py",
      "test_name": "test_transfer_at_threshold_pending",
      "exists": true
    },
    {
      "file": "ledgerlite/tests/test_spec5_large_transfer_threshold.py",
      "test_name": "test_transfer_above_threshold_pending",
      "exists": true
    },
    {
      "file": "ledgerlite/tests/test_spec5_large_transfer_threshold.py",
      "test_name": "test_transfer_just_below_threshold_completed",
      "exists": true
    }
  ]
}
