{
  "id": "REQ-09",
  "status": "covered",
  "reason": "The implementation introduces a hard cap of 20,000.00 in outgoing transfers per UTC calendar day. The constant _DAILY_TRANSFER_CAP is defined at module level and the check runs inside the transfer service before any balance mutation: it sums all transfers with status 'completed' or 'pending_approval' for the sender since today_start (UTC midnight), converts the aggregate to Decimal, and raises HTTP 400 when daily_total + amount > _DAILY_TRANSFER_CAP. Three dedicated tests cover the boundary exactly (20,000.00 accepted), the first cent over the boundary (20,000.01 rejected), and a three-transfer scenario where the third transfer is blocked.",
  "code_evidence": [
    {
      "file": "ledgerlite/services.py",
      "line": 22,
      "snippet": "_DAILY_TRANSFER_CAP = Decimal(\"20000.00\")",
      "verified": true,
      "match": "exact",
      "actual_line": 22,
      "actual_snippet": "_DAILY_TRANSFER_CAP = Decimal(\"20000.00\")"
    },
    {
      "file": "ledgerlite/services.py",
      "line": 198,
      "snippet": "    today_utc = datetime.datetime.now(timezone.utc).date()",
      "verified": true,
      "match": "exact",
      "actual_line": 198,
      "actual_snippet": "    today_utc = datetime.datetime.now(timezone.utc).date()"
    },
    {
      "file": "ledgerlite/services.py",
      "line": 199,
      "snippet": "    today_start = datetime.datetime(today_utc.year, today_utc.month, today_utc.day, tzinfo=timezone.utc)",
      "verified": true,
      "match": "exact",
      "actual_line": 199,
      "actual_snippet": "    today_start = datetime.datetime(today_utc.year, today_utc.month, today_utc.day, tzinfo=timezone.utc)"
    },
    {
      "file": "ledgerlite/services.py",
      "line": 201,
      "snippet": "    daily_total_row = (",
      "verified": true,
      "match": "exact",
      "actual_line": 201,
      "actual_snippet": "    daily_total_row = ("
    },
    {
      "file": "ledgerlite/services.py",
      "line": 210,
      "snippet": "    daily_total = Decimal(str(daily_total_row[0]))",
      "verified": true,
      "match": "exact",
      "actual_line": 210,
      "actual_snippet": "    daily_total = Decimal(str(daily_total_row[0]))"
    },
    {
      "file": "ledgerlite/services.py",
      "line": 211,
      "snippet": "    if daily_total + amount > _DAILY_TRANSFER_CAP:",
      "verified": true,
      "match": "exact",
      "actual_line": 211,
      "actual_snippet": "    if daily_total + amount > _DAILY_TRANSFER_CAP:"
    },
    {
      "file": "ledgerlite/services.py",
      "line": 212,
      "snippet": "        raise HTTPException(",
      "verified": true,
      "match": "exact",
      "actual_line": 212,
      "actual_snippet": "        raise HTTPException("
    }
  ],
  "test_evidence": [
    {
      "file": "ledgerlite/tests/test_spec9_daily_cap.py",
      "test_name": "test_daily_cap_exact_boundary_accepted",
      "exists": true
    },
    {
      "file": "ledgerlite/tests/test_spec9_daily_cap.py",
      "test_name": "test_daily_cap_exceeded_rejected",
      "exists": true
    },
    {
      "file": "ledgerlite/tests/test_spec9_daily_cap.py",
      "test_name": "test_daily_cap_three_transfers_third_blocked",
      "exists": true
    }
  ],
  "suggested_fix": ""
}
